{
  "$schema": "https://json-schema.org/draft/2020-12/schema",
  "$id": "urn:lrail:contracts:events:v1:event-envelope",
  "title": "Lrail event envelope v1",
  "description": "Canonical envelope for events crossing Lrail component boundaries.",
  "type": "object",
  "additionalProperties": false,
  "required": [
    "event_id",
    "event_type",
    "occurred_at",
    "organization_id",
    "resource_id",
    "correlation_id",
    "idempotency_key",
    "producer",
    "schema_version",
    "data"
  ],
  "properties": {
    "event_id": {
      "type": "string",
      "format": "uuid"
    },
    "event_type": {
      "type": "string",
      "pattern": "^[a-z][a-z0-9_]*(\\.[a-z][a-z0-9_]*)+\\.v[1-9][0-9]*$"
    },
    "occurred_at": {
      "type": "string",
      "format": "date-time"
    },
    "organization_id": {
      "type": "string",
      "format": "uuid"
    },
    "resource_id": {
      "type": "string",
      "format": "uuid"
    },
    "correlation_id": {
      "type": "string",
      "format": "uuid"
    },
    "idempotency_key": {
      "type": "string",
      "minLength": 1,
      "maxLength": 255
    },
    "producer": {
      "type": "string",
      "pattern": "^[a-z][a-z0-9-]*$",
      "maxLength": 63
    },
    "schema_version": {
      "const": 1
    },
    "data": {
      "type": "object"
    }
  }
}