{
  "event_id": "019b9a80-0000-7000-8000-000000000040",
  "event_type": "deployment.runtime.ready.v1",
  "occurred_at": "2026-07-12T00:00:00Z",
  "organization_id": "019b9a80-0000-7000-8000-000000000002",
  "resource_id": "019b9a80-0000-7000-8000-000000000003",
  "correlation_id": "019b9a80-0000-7000-8000-000000000004",
  "idempotency_key": "local-provider:019b9a80-0000-7000-8000-000000000010:ready",
  "producer": "local-provider",
  "schema_version": 1,
  "data": {
    "deployment_id": "019b9a80-0000-7000-8000-000000000003",
    "operation_id": "019b9a80-0000-7000-8000-000000000010",
    "expected_version": 0,
    "artifact_digest": "sha256:8e785f6f5f35dbf8f6e6f08d517f56bf1822b4e225dc5f402f294bbf4e2f1c41",
    "region": "local",
    "cell": "docker-desktop",
    "readiness": {
      "status": "passed",
      "checked_at": "2026-07-12T00:00:00Z"
    }
  }
}
