{
  "event_id": "019b9a80-0000-7000-8000-000000000050",
  "event_type": "build.requested.v1",
  "occurred_at": "2026-07-12T12:00:00Z",
  "organization_id": "019b9a80-0000-7000-8000-000000000002",
  "resource_id": "019b9a80-0000-7000-8000-000000000005",
  "correlation_id": "019b9a80-0000-7000-8000-000000000004",
  "idempotency_key": "build:019b9a80-0000-7000-8000-000000000005:requested",
  "producer": "control-plane",
  "schema_version": 1,
  "data": {
    "contract_version": 1,
    "command_type": "build.start",
    "operation_id": "019b9a80-0000-7000-8000-000000000010",
    "organization_id": "019b9a80-0000-7000-8000-000000000002",
    "deployment_id": "019b9a80-0000-7000-8000-000000000003",
    "build_id": "019b9a80-0000-7000-8000-000000000005",
    "revision_id": "019b9a80-0000-7000-8000-000000000006",
    "service_id": "019b9a80-0000-7000-8000-000000000011",
    "expected_version": 3,
    "workload_type": "web",
    "repository": "lrail/019b9a80-0000-7000-8000-000000000002/019b9a80-0000-7000-8000-000000000011",
    "source_commit": "0123456789abcdef0123456789abcdef01234567",
    "source_root": ".",
    "descriptor_digest": "sha256:aaaaaaaaaaaaaaaaaaaaaaaaaaaaaaaaaaaaaaaaaaaaaaaaaaaaaaaaaaaaaaaa"
  }
}
