{
  "event_id": "019b9a80-0000-7000-8000-000000000052",
  "event_type": "deployment.runtime.canceled.v1",
  "occurred_at": "2026-07-12T00:05:01Z",
  "organization_id": "019b9a80-0000-7000-8000-000000000002",
  "resource_id": "019b9a80-0000-7000-8000-000000000003",
  "correlation_id": "019b9a80-0000-7000-8000-000000000004",
  "idempotency_key": "local-provider:019b9a80-0000-7000-8000-000000000050:canceled",
  "producer": "local-provider",
  "schema_version": 1,
  "data": {
    "deployment_id": "019b9a80-0000-7000-8000-000000000003",
    "operation_id": "019b9a80-0000-7000-8000-000000000050",
    "expected_version": 9
  }
}
